Rank,Name,Developer,Category,Size,Star Rating,Reviews,Downloads,Rated for
1,Where is my Train,Sigmoid Labs and its Affiliates,Travel & Local,10 MB,4.4,29L,10Cr+,3+
2,Train Status Ticket Book PNR,"ixigo - IRCTC Authorised Partner, Flight Tickets",Travel & Local,18 MB,4.4,19L,10Cr+,3+
3,IRCTC Rail Connect,IRCTC Official,Travel & Local,16 MB,4,22L,5Cr+,3+
4,ConfirmTkt - Train Booking,ConfirmTkt - IRCTC Authorised Partner,Travel & Local,14 MB,4.6,4L,1Cr+,3+
5,Google Earth,Google LLC,Travel & Local,8.6 MB,4.4,28L,10Cr+,3+
6,OYO : Book Safe Rooms With Best Hotel Booking App,OYO,Travel & Local,17 MB,4.3,7L,5Cr+,3+
7,"Train App: Book Tickets, PNR","RailYatri - IRCTC Authorized Partner, IntrCity Bus",Travel & Local,15 MB,4.3,7L,1Cr+,3+
8,"Book Bus, Train Tickets & Cabs",redBus,Travel & Local,28 MB,4.4,14L,1Cr+,3+
9,MakeMyTrip: Travel Booking App,"MakeMyTrip—Hotel, Flight, IRCTC Authorised Partner",Travel & Local,48 MB,4.4,11L,5Cr+,3+
10,UTS,Centre for Railway Information Systems,Travel & Local,14 MB,4.1,7L,1Cr+,3+
11,m-Indicator: Mumbai Local Train Timetable,Mobond,Travel & Local,19 MB,4.4,4L,1Cr+,3+
12,Zoomcar - Self drive Car rental,Zoomcar India Private Limited,Travel & Local,32 MB,4,1L,1Cr+,3+
13,RTO Vehicle Information & Vehicle Price Check App,Poonam AppsZone,Travel & Local,6.6 MB,4.2,1L,1Cr+,3+
14,Google Street View,Google LLC,Travel & Local,25 MB,4.1,23L,100Cr+,3+
15,Indian Railway Train Status,Mohan Noone,Travel & Local,5.2 MB,4.3,1L,1Cr+,3+
16,Flight Booking & Cheap Flights,"ixigo - IRCTC Authorised Partner, Flight Tickets",Travel & Local,12 MB,4.5,1L,1Cr+,3+
17,Gadi Number se Vahan Malik ka nam Pata kare,Hangover Studios,Travel & Local,6.0 MB,4.4,9T,10L+,3+
18,AbhiBus Bus Ticket Booking App,abhibus - SRTC & Intercity Volvo Booking,Travel & Local,25 MB,4.5,1L,50L+,3+
19,Booking.com: Hotels and more,Booking.com Hotels & Vacation Rentals,Travel & Local,38 MB,4.4,32L,10Cr+,3+
20,NoteCam Lite - photo with notes [GPS Camera],Derekr Corp.,Travel & Local,5.3 MB,4.1,11T,50L+,3+
21,GPS Navigation Live Map,Map Zone Studio,Travel & Local,7.5 MB,4,18T,1Cr+,3+
22,"JD -Search, Shop, Travel, Food, B2B",Just Dial Ltd.,Travel & Local,39 MB,4.5,4L,1Cr+,3+
23,Govinda - Tirumala Tirupati Devasthanams,TTD Official,Travel & Local,38 MB,4,34T,10L+,3+
24,Flying Jet Robot Car Transform Games,Grand Robot Fight,Travel & Local,48 MB,4.1,19T,50L+,12+
25,Goibibo Hotel Flight Train Bus,"Goibibo — Hotel, Flight, IRCTC Authorised Partner",Travel & Local,29 MB,4.4,10L,5Cr+,3+
26,GPS Navigation: Weather Map,Sharp Apps Studio,Travel & Local,6.8 MB,4,5T,10L+,3+
27,NTES,Centre for Railway Information Systems,Travel & Local,9.6 MB,4.2,3L,1Cr+,3+
28,Train Man: Train Booking & PNR,Train man - IRCTC Authorised Partner,Travel & Local,15 MB,4.3,1L,50L+,3+
29,IndiGo-Flight Ticket Booking App,InterGlobe Aviation Limited,Travel & Local,13 MB,4.6,1L,1Cr+,3+
30,Google Maps Go,Google LLC,Travel & Local,2.8 MB,4.1,2L,50Cr+,3+
31,"Live Train Status: PNR Status, Indian Railway Info",jp25,Travel & Local,10 MB,3.7,233,1L+,12+
32,GPS Map Camera,JK.Fantasy,Travel & Local,2.8 MB,4.2,64T,1Cr+,3+
33,Agoda,agoda.com,Travel & Local,84 MB,3.6,5L,1Cr+,3+
34,BlaBlaCar: travel by carpool,BlaBlaCar,Travel & Local,36 MB,4.6,16L,5Cr+,3+
35,Real Military Coach Simulator,Game Town Studio,Travel & Local,88 MB,4.1,13T,1Cr+,7+
36,Tirupati Online Booking (TTD),Sree Sai Prakash Medi,Travel & Local,50 MB,4.3,5T,10L+,3+
37,Airbnb,Airbnb,Travel & Local,44 MB,4.3,12L,10Cr+,3+
38,Marriott Bonvoy,Marriott International,Travel & Local,90 MB,4.7,1L,50L+,3+
39,"Cheap Flights, Hotel, Bus & Book TRAIN: EaseMyTrip",EaseMyTrip: IRCTC Authorised Partner,Travel & Local,22 MB,4.5,75T,50L+,3+
40,Cargo Tractor Trolley Game - Tractor Trolley 2021,Racing Games 2021,Travel & Local,36 MB,3.9,1T,1L+,3+
41,"Challan, Vahan,  RTO info: India",Extras Studeio,Travel & Local,22 MB,4.5,3T,5L+,3+
42,Family Locator - GPS Tracker & Find Your Phone App,FAMILY LOCATOR LLC,Travel & Local,17 MB,4.1,3L,1Cr+,3+
43,Flightradar24 Flight Tracker,Flightradar24 AB,Travel & Local,56 MB,4.6,4L,1Cr+,3+
44,Bus Wala Game: Bus Simulator,Gaming Legends - Racing Games,Travel & Local,69 MB,3.6,12T,50L+,3+
45,Real Tractor Pulling Simulator: Offroad | City Mod,Redstone Creatives,Travel & Local,40 MB,3.6,1T,10L+,3+
46,Location Satellite Maps,Avenue Infotech Dev.Shashikant S,Travel & Local,4.2 MB,4.1,6T,50L+,3+
47,Cleartrip - Travel Booking App,Cleartrip,Travel & Local,11 MB,4.3,2L,1Cr+,3+
48,Go First,Go Airlines (India) Limited,Travel & Local,50 MB,2.6,11T,10L+,3+
49,Yulu,Yulu,Travel & Local,28 MB,4.2,65T,10L+,3+
50,GSRTC,GSRTC Official Ticket Booking App.,Travel & Local,13 MB,3.3,14T,10L+,3+
51,trivago: Compare hotel prices,trivago,Travel & Local,16 MB,3.9,3L,5Cr+,3+
52,Navigation for Google Maps Go,Google LLC,Travel & Local,11 MB,4.1,2L,50Cr+,3+
53,Phone Number Tracker - Mobile Numer Locator Free,Fifty Shades of Apps,Travel & Local,5.6 MB,3.5,21T,50L+,3+
54,Air India,Air India,Travel & Local,14 MB,3.9,31T,10L+,3+
55,Book Bus Tickets Online: IntrCity SmartBus App,"RailYatri - IRCTC Authorized Partner, IntrCity Bus",Travel & Local,16 MB,4.4,8T,10L+,3+
56,"Wego Flights, Hotels, Trains & Activities Booking",Wego.com,Travel & Local,20 MB,4.2,1L,1Cr+,3+
57,Indian Railway Timetable - Live train location,Appspundit Infotech,Travel & Local,14 MB,3.9,14T,10L+,3+
58,Location of my train : Live Train Status,App Times,Travel & Local,13 MB,3.8,7T,10L+,3+
59,Tirumala Tirupati Online Booking,EPIXS Media,Travel & Local,5.8 MB,4.2,3T,50T+,3+
60,Blinctrip - Flight Ticket Booking & Trip Planner,Digital Blinc,Travel & Local,22 MB,4.1,684,1L+,3+
61,Yatra - Flights Hotels Bus IRCTC/Trains & Ola/Uber,"Yatra.com- Flight, Hotel, IRCTC Authorized Partner",Travel & Local,25 MB,4.1,3L,1Cr+,3+
62,RTO Vehicle Owner Details 2021,Ultimate Games Studio,Travel & Local,12 MB,3.7,2T,5L+,3+
63,Banduk Wala Game Ka Baap: Fire,Purple Pillow Games,Travel & Local,45 MB,3.7,10T,10L+,16+
64,GPS Photo: Photo with GPS Location & Map View,GoNext,Travel & Local,9.8 MB,3.9,2T,5L+,3+
65,Travel Buddy: Find a Local & Plan Your Trip,Terrainspotter,Travel & Local,24 MB,4.7,5T,5L+,12+
66,Delhi Metro Route Map and Fare,Appspundit Infotech,Travel & Local,16 MB,4.3,18T,10L+,3+
67,RTO Vehicle Information,Ketan Gupta,Travel & Local,8.9 MB,4.3,2T,1L+,3+
68,Hourly Rooms,WOWROOMS hospitality pvt ltd,Travel & Local,18 MB,4.3,1T,50T+,3+
69,Google Maps,Google LLC,Travel & Local,32 MB,4.3,1Cr,1TCr+,3+
70,Revv - Self Drive Car Rentals,PrimeMover Mobility Technologies Pvt. Ltd.,Travel & Local,12 MB,4.4,24T,10L+,3+
71,Flying Grand Police Car Transform Robot Games,Grand Superhero Games,Travel & Local,50 MB,3.9,3T,10L+,12+
72,Indian Railway PNR staus - Train Live Status,Honiry Xidoa,Travel & Local,16 MB,4.1,57,1L+,3+
73,Impossible School Bus Simulator Tracks Driving,Hi5 Games Studio,Travel & Local,80 MB,4.5,2T,1L+,3+
74,Mobile IRCTC Ticket Booking & PNR Status,EasyTrain - IRCTC Ticket Booking,Travel & Local,10 MB,4.1,29T,50L+,3+
75,Live Train : Locate My Train,Go Finger,Travel & Local,15 MB,4.6,29T,10L+,3+
76,Speedbot. Free GPS/OBD2 Speedometer,Iteration Mobile & Vialsoft Apps,Travel & Local,8.0 MB,4,6T,10L+,3+
77,GPS Navigation Live Earth Map,HS Tech Apps,Travel & Local,4.8 MB,4.2,650,1L+,3+
78,Brevistay: Your App for Hourly Hotels,Brevistay Hospitality Pvt. Ltd.,Travel & Local,29 MB,4.6,3T,1L+,3+
79,IRCTC App: Indian Railway Train & IRTC Info,IRCTC & Indian Railway App by SmartApps India,Travel & Local,8.1 MB,4.5,2L,1Cr+,3+
80,Where is my train? Railways,Baleli Viket,Travel & Local,5.1 MB,4.2,111,10T+,18+
81,highway delite,highway delight,Travel & Local,15 MB,4.5,4T,1L+,3+
82,Fly GPS-Location fake/Fake GPS,SAMBOKING,Travel & Local,3.3 MB,3.8,1L,1Cr+,3+
83,APSRTC,Andhra Pradesh State Road Transport Corporation,Travel & Local,5.1 MB,3.4,13T,10L+,3+
84,Speak & Translate – Camera Voice Translator & Chat,AppSoNix,Travel & Local,13 MB,4.3,7T,10L+,3+
85,Digital Compass - Smart Compass for Android,Apps Wing,Travel & Local,4.7 MB,4.3,13T,10L+,3+
86,Tirupati Darshan Booking(TTD) -Colours of Tirupati,Colours of Tirupati,Travel & Local,17 MB,4.5,507,1L+,12+
87,CNG Eco Connect,Innostack Hexa Solutions Private Ltd.,Travel & Local,9.1 MB,4.3,2T,1L+,3+
88,Airport  Construction  Builder,GameFit,Travel & Local,59 MB,4.9,16T,50L+,12+
89,Robot Airplane Pilot Games 3D,Buntoo Games,Travel & Local,41 MB,3.9,11T,50L+,3+
90,RapidGo(Beta),Amnex Infotechnologies Pvt Ltd,Travel & Local,9.5 MB,3.2,5T,10L+,3+
91,Auto Cab,binoy babu,Travel & Local,10 MB,4.1,245,1L+,3+
92,Live Earth Webcam: GPS Maps 3D,Droid-Developer,Travel & Local,11 MB,4.4,7T,10L+,3+
93,SpiceJet,SpiceJet Limited,Travel & Local,21 MB,3.2,34T,50L+,3+
94,RTO Vehicle Information,RTO App King,Travel & Local,11 MB,3.8,1T,5L+,3+
95,Air Force Shooter 3D - Helicopter Shooting Games,Lobster Game Studios,Travel & Local,78 MB,3.7,37T,1Cr+,16+
96,TNSTC Official App,TNSTC OFFICIAL TICKET BOOKING APP,Travel & Local,13 MB,3.3,1T,5L+,3+
97,Car Simulator 2021 : Terzo Drift & drive,Drift Simulator Games,Travel & Local,48 MB,4.1,829,1L+,3+
98,"InterMiles: Loyalty, Shopping & Travel Rewards App",Jet Privilege Pvt Ltd,Travel & Local,19 MB,3.2,15T,10L+,3+
99,Special Ops Multiplayer,GamesEntity,Travel & Local,62 MB,3.9,953,5L+,16+
100,ATV Pizza Delivery Boy,Game valley,Travel & Local,58 MB,4.2,7T,10L+,12+
101,Tuk Tuk Auto Riksha Wali Game,Whiplash Mediaworks,Travel & Local,51 MB,4,65T,1Cr+,3+
102,Chartered Bus,Chartered Speed Limited,Travel & Local,8.2 MB,3.2,1T,1L+,3+
103,Live Train Location : Indian Railway Train Status,Synergy App Studio,Travel & Local,13 MB,4.3,397,1L+,3+
104,IRCTC Rail Connect - for RAIL SAARTHI,Centre for Railway Information Systems,Travel & Local,16 MB,4,57T,10L+,3+
105,Tirupati Online Booking,Colours of Tirupati,Travel & Local,9.2 MB,4.1,226,1L+,3+
106,Couchsurfing Travel App,CouchSurfing Inc.,Travel & Local,8.7 MB,4.2,1L,50L+,12+
107,Tuk Tuk Rickshaw: Impossible,Hi5 Games Studio,Travel & Local,87 MB,4.8,1T,5L+,3+
108,"Indian Railways Information, PNR & Running Status",etrain.info,Travel & Local,3.3 MB,4.5,23T,10L+,3+
109,KSRTC,Karnataka State Road Transport Corporation,Travel & Local,1.5 MB,3.2,6T,10L+,3+
110,MYBYK | Bicycle Rental & Sharing,Greenpedia Bike Share Private Limited,Travel & Local,47 MB,4.3,13T,1L+,3+
111,"Vistara - India's Best Airline, Flight Bookings",Tata SIA Airlines Ltd.,Travel & Local,7.5 MB,3.6,8T,10L+,3+
112,Planes Live - Flight Tracker,Weather or Not Apps,Travel & Local,33 MB,4.1,37T,10L+,3+
113,FollowMee GPS Tracker: Locate & Track Your Device,FollowMee LLC,Travel & Local,4.0 MB,4,1T,10L+,3+
114,SmartBike,SmartBike Mobility,Travel & Local,48 MB,4,4T,1L+,3+
115,Location Map,dev zmobile,Travel & Local,4.6 MB,4.4,7T,10L+,3+
116,Compass - Accurate & Digital Compass for Android,Trusted Tools & Utilities Apps,Travel & Local,5.4 MB,4.1,27T,50L+,3+
117,Tripadvisor: Plan & Book Trips,Tripadvisor,Travel & Local,19 MB,4.4,14L,10Cr+,3+
118,Indian Railway Train Status,Team_IND,Travel & Local,5.0 MB,4,138,1L+,3+
119,NaviMaps: 3D GPS Navigation,MapmyIndia,Travel & Local,47 MB,4.3,13T,10L+,3+
120,Real Tractor Trolley Cargo Farming Simulation 2,Simulation Games Studios,Travel & Local,50 MB,3.7,4T,10L+,3+
121,Skyscanner - travel deals,Skyscanner Ltd,Travel & Local,34 MB,4.6,7L,5Cr+,3+
122,udChalo,upCurve Business Services Pvt Ltd,Travel & Local,34 MB,4,5T,10L+,3+
123,Chartered Bike,Chartered Bike Private Limited,Travel & Local,13 MB,2.5,2T,1L+,3+
124,Mumbai Local Train Timetable,MIIN,Travel & Local,4.4 MB,4.5,7T,10L+,3+
125,"Expedia: Hotels, Flights & Car",Expedia,Travel & Local,21 MB,3.7,2L,1Cr+,3+
126,Vehicle Information - Find Vehicle Owner Details,SkyTouch InfoSoft,Travel & Local,5.9 MB,4.2,22T,10L+,3+
127,Local Train Time Table : Suburban Train Timings,i-Soft,Travel & Local,1.2 MB,3.9,2T,10L+,3+
128,Savaari - Outstation Car Rental & Airport Taxi App,Savaari Car Rentals Private Limited,Travel & Local,14 MB,4.4,3T,1L+,3+
129,Extreme Car Driving Simulator : Range Rover Drift,Drift Simulator Games,Travel & Local,47 MB,3.2,881,1L+,12+
130,Happyfares,Happyfares,Travel & Local,10 MB,3.6,84,50T+,3+
131,GPS Live Satellite View Map,Game Axe,Travel & Local,20 MB,4.1,728,5L+,3+
132,Official Mumbai Local App.,"Central Railways, Mumbai Division",Travel & Local,26 MB,4,557,1L+,3+
133,Travelxp: Watch Travel Shows & Book Your Trip,Travelxp,Travel & Local,22 MB,4.7,1T,50T+,3+
134,"Quick Tatkal-Train Ticket, PNR",Afre Studios,Travel & Local,10 MB,4.3,5T,5L+,3+
135,IRCTC AIR,IRCTC Official,Travel & Local,7.7 MB,4.2,79T,1Cr+,3+
136,RSRTC RESERVATION APP,Ebix Inc.,Travel & Local,20 MB,3.9,2T,5L+,3+
137,GPS Navigation & Map Direction,Sharp Apps Studio,Travel & Local,7.5 MB,4.1,51T,1Cr+,3+
138,"FabHotels: Hotel Booking App, Best Budget Hotels",FabHotels: Online Hotel Booking App,Travel & Local,15 MB,4.6,19T,10L+,3+
139,"Delhi Metro Map,Route, DTC Bus Number Guide - 2020",OJAL TECH,Travel & Local,7.1 MB,4.5,28T,10L+,3+
140,Live Flight Tracker,12d Technology,Travel & Local,12 MB,3.5,4T,10L+,3+
141,Live Train Status And Train Enquiry,Sensible Labs,Travel & Local,6.1 MB,3.9,3T,10L+,3+
142,Compass,AwesomeDev,Travel & Local,3.7 MB,4.2,18T,50L+,3+
143,UTS - for RAIL SAARTHI,Centre for Railway Information Systems,Travel & Local,7.9 MB,3.8,8T,5L+,3+
144,BEST प्रवास (Prawas),BEST Undertaking,Travel & Local,8.3 MB,3.4,2T,1L+,3+
145,Radisson Hotels – hotel booking app,Radisson Hotel Group,Travel & Local,23 MB,3.9,661,1L+,3+
146,Mumbai (Data) - m-Indicator,Mobond,Travel & Local,1.7 MB,4.1,4T,10L+,3+
147,Grand Flying Helicopter Robot Car Shooting 2021,Grand Robot Fight,Travel & Local,49 MB,4,1T,5L+,12+
148,Geo Tracker - GPS tracker,Ilya Bogdanovich,Travel & Local,13 MB,4.4,70T,50L+,3+
149,MyChoize Self Drive Cars and Car Rentals,ORIX Auto Infrastructure Services Limited,Travel & Local,9.8 MB,4.2,5T,5L+,3+
150,AirAsia India,TATA Digital Limited,Travel & Local,11 MB,3.1,315,50T+,3+
151,Satellite View Earth Globe Map,Buksh apps,Travel & Local,16 MB,4.3,522,1L+,3+
152,EasyConnection-CarbitLink,"Wuhan CARBIT Information Co.,Ltd",Travel & Local,24 MB,3.6,6T,10L+,3+
153,Mumbai Local Train Route Map & Timetable,Appspundit Infotech,Travel & Local,20 MB,4.1,3T,10L+,3+
154,Peindia Cab,Peindia Digital,Travel & Local,12 MB,3.6,84,10T+,3+
155,Kolkata Suburban Trains,Jane Juje Fernandes,Travel & Local,4.2 MB,4.1,28T,10L+,3+
156,Nashik City Bus,Nashik Mahanagar Parivahan Mahamandal Ltd,Travel & Local,10 MB,4,1T,1L+,3+
157,Hello High School Scary Teacher Escape 3D,angel game studio,Travel & Local,67 MB,4.2,3T,10L+,12+
158,Passport Size Photo Maker,Yarsa Labs,Travel & Local,6.1 MB,4.3,17T,10L+,3+
159,Voice Gps Maps Travel Navigation & Traffic Alerts,Sibiti Apps,Travel & Local,11 MB,4.1,7T,10L+,3+
160,ArriveCAN,CBSA-ASFC,Travel & Local,14 MB,4.8,63T,10L+,3+
161,Truck Simulator : 2021,Redstone Creatives,Travel & Local,44 MB,3.7,1T,5L+,3+
162,Live Camera - Street View,Satellite World Maps,Travel & Local,9.3 MB,4.7,7T,10L+,3+
163,All Vehicle Information - Vehicle Owner Details,Photo Collage & Grid Maker and Photo Video Editor,Travel & Local,7.3 MB,4.4,427,1L+,3+
164,MAPS.ME: Offline maps GPS Nav,MAPS.ME (CYPRUS) LTD,Travel & Local,95 MB,4.3,12L,5Cr+,3+
165,US Police Monster Truck Robot,Lobster Game Studios,Travel & Local,61 MB,3.8,5T,50L+,12+
166,Namma Metro (BMRCL official app),BMRCL,Travel & Local,14 MB,3.8,1T,1L+,3+
167,Taxi Driver - Quick Ride Zory,iDisha,Travel & Local,12 MB,4.7,4T,50T+,3+
168,MO BUS – The way we move,Capital Region Urban Transport,Travel & Local,6.8 MB,3.4,5T,5L+,3+
169,Royal Brothers - Bike Rentals,Royal Brothers Bike Rentals,Travel & Local,13 MB,4.1,2T,1L+,3+
170,GOAMILES,FROTAMILES PVT LTD,Travel & Local,7.3 MB,3.5,8T,5L+,3+
171,Cheapflights Flights & Hotels,KAYAK.com,Travel & Local,25 MB,4.1,59T,1Cr+,3+
172,Zoop - Order Food in Trains,IRCTC Authorised,Travel & Local,9.9 MB,4.2,4T,1L+,3+
173,"Drivezy - Car, Bike & Scooter Rentals",Drivezy Car Rental,Travel & Local,19 MB,2.7,26T,10L+,3+
174,TSRTC Official Online Booking,Telangana State Road Transport Corporation,Travel & Local,7.4 MB,3.5,2T,5L+,3+
175,HappyEasyGo – Flights & Hotels,Happyeasygo,Travel & Local,25 MB,4.4,61T,10L+,3+
176,World Clock Widget,Tomas Hubalek,Travel & Local,6.4 MB,4.4,20T,10L+,3+
177,Bag2Bag - Book Hotel by hours,Bag2Bag,Travel & Local,17 MB,4.4,237,50T+,3+
178,TAXI Booking - CAB Booking App,Educom Apps,Travel & Local,2.9 MB,3.8,1T,10L+,3+
179,Bus Simulator - Offroad Bus,Offroad Games 2020,Travel & Local,27 MB,4,5T,10L+,3+
180,RTO Vehicle Information - Vehicle Owner Details,NetQ Technologies,Travel & Local,9.2 MB,4.1,505,1L+,3+
181,Flying Monster Robot Rope Hero,Brilliant Gamez,Travel & Local,48 MB,4,5T,10L+,12+
182,Rasta Dikhane Wala App l हिंदी मैप,Urva Apps,Travel & Local,6.7 MB,4.1,138,1L+,3+
183,Qatar Airways,Qatar Airways,Travel & Local,78 MB,4.7,33T,10L+,3+
184,My Train Info - PNR & Where is My Train,AppAspect Technologies Pvt. Ltd.,Travel & Local,13 MB,3.6,1T,5L+,3+
185,Quick Ride Carpool & Taxi,iDisha,Travel & Local,30 MB,4.5,82T,10L+,3+
186,Chennai Metro Rail,Chennai Metro Rail Limited,Travel & Local,15 MB,3.5,1T,1L+,3+
187,zingbus: Bus Tickets Online,zingbus,Travel & Local,19 MB,4.6,5T,50T+,3+
188,"Bus Schedule, Time Table for GSRTC",NetQ Technologies,Travel & Local,10.0 MB,3.7,838,1L+,3+
189,Car Racing Games 2021 - Car Games 2021,Racing Games 2021,Travel & Local,34 MB,4.3,1T,1L+,3+
190,World Clock : Time of All Countries,Little Angel,Travel & Local,7.9 MB,3.7,1T,5L+,3+
191,Justdial Lite,Just Dial Ltd.,Travel & Local,3.8 MB,4.1,39T,50L+,3+
192,PRV Rentals,PRV Rentals Pvt Limited,Travel & Local,15 MB,4.1,48,5T+,3+
193,GPS map camera Lite for photo location & Timestamp,All Excellent Apps,Travel & Local,11 MB,4.2,985,1L+,3+
194,Mountain Auto Tuk Tuk Rickshaw,Lobster Game Studios,Travel & Local,77 MB,3.8,40T,1Cr+,3+
195,Hotel Discounts,Cheap Hotel Booking・Flights & Cars by Discounts50,Travel & Local,8.1 MB,4.8,14T,5L+,3+
196,Ente KSRTC,Kerala RTC,Travel & Local,3.7 MB,3.5,617,1L+,3+
197,Chennai Local Train Timetable,MIIN,Travel & Local,4.2 MB,4.1,4T,10L+,3+
198,Zoomcar Host,Zoomcar India Private Limited,Travel & Local,41 MB,4.2,806,10T+,3+
199,Emirates,EmiratesGroup,Travel & Local,79 MB,4.7,58T,50L+,3+
200,"eRail.in Railways Train Time Table, Seats, Fare",eRail.in,Travel & Local,2.2 MB,4,40T,10L+,3+
201,MetroRide India,ThinkCrazy Technologies Pvt Ltd,Travel & Local,20 MB,4.7,575,50T+,3+
202,NMMT BusTracker,Amnex Infotechnologies Pvt Ltd,Travel & Local,8.9 MB,2.9,2T,1L+,3+
203,Modern Train Simulator - Offline Train Game,GT Action Games,Travel & Local,85 MB,3.8,24T,1Cr+,3+
204,Police Motorcycle Chase-Bike Game,Trend Entertainment Games,Travel & Local,45 MB,3.9,2T,10L+,16+
205,SmartDrive,Bharat Petroleum Corporation Limited,Travel & Local,14 MB,2.7,2T,1L+,3+
206,Police Ship Driving Simulator Real Transport,play.io,Travel & Local,55 MB,4,2T,10L+,12+
207,Travel Union- Bus Flight Hotel,Spice Money LTD,Travel & Local,32 MB,4.1,1T,1L+,3+
208,Endless Temple Water slide : Frozen Oz Jungle,U Gaming Art,Travel & Local,59 MB,4.1,248,1L+,16+
209,Train PNR Status Enquiry And Live Updates,DesignTheDots,Travel & Local,11 MB,3.8,288,1L+,3+
210,High School Gangster Fighting 3D - Crime Simulator,Piranha Studios,Travel & Local,62 MB,3.7,9T,10L+,16+
211,ITC Hotels,ITC Ltd.,Travel & Local,40 MB,5,225,1T+,3+
212,Jeep Stunt Car driving games,Rise Games,Travel & Local,23 MB,4,354,1L+,12+
213,Terzo Millennio Car Simulator: Real City Car Games,Elevated Games 13,Travel & Local,25 MB,4.2,58,10T+,3+
214,Offline Wrestling Games 2022,The Playtime Studios,Travel & Local,41 MB,3.9,2T,10L+,12+
215,AryaGo Cab- Brand Of Bihar,Aryago Transpotech India Pvt. Ltd,Travel & Local,12 MB,4.6,1T,1L+,3+
216,Statue Of Unity Tickets (Official),SOUTICKETS.IN,Travel & Local,26 MB,4.1,284,1L+,3+
217,TSavaari - Official App of Hyderabad Metro Rail,TSavaari L&TMRHL,Travel & Local,9.1 MB,4.2,11T,1L+,3+
218,Vroom Self Drive Car Rental,Vroom Self Drive Car Rental,Travel & Local,4.4 MB,4,2T,1L+,3+
219,rPool - rideshare by redBus,redBus,Travel & Local,15 MB,2.2,47,10T+,3+
220,Rescue Robot Car Transform,Epic Games Production,Travel & Local,63 MB,4.2,1T,10L+,7+
221,Compass Pro - Compass Map,SmartTool .Inc,Travel & Local,11 MB,4.3,304,50T+,3+
222,Holiday Swap,Holiday Swap,Travel & Local,461 kB,3,1T,5L+,3+
223,"ONN - Ride Scooters, Motorcycles & more",MOTOCRUIZER TECHNOLOGIES INDIA PRIVATE LIMITED,Travel & Local,14 MB,3.7,14T,5L+,3+
224,Online Ticket Booking,Own Ideas,Travel & Local,3.9 MB,4,551,5L+,3+
225,Colours Magazine,"Joomag, Inc.",Travel & Local,12 MB,3.9,234,1L+,3+
226,Offroad Water Tank Transport Truck Driving Game,Victor Games Production,Travel & Local,53 MB,3.6,136,1L+,7+
227,Family Locator - GPS Tracker For Find My Friends,Fifty Shades of Apps,Travel & Local,6.2 MB,4.3,15T,10L+,3+
228,GPS Alarm Route Finder - Map Alarm & Route Planner,Attractive Apps Valley,Travel & Local,7.7 MB,3.9,4T,10L+,12+
229,PRTC Bus Time Table & Live Tracking,IT Cell PRTC,Travel & Local,5.7 MB,4,196,1L+,3+
230,RailMadad,Centre for Railway Information Systems,Travel & Local,14 MB,2.4,836,1L+,3+
231,Car Mechanic Car Driving Sim,Dragon Fire Z,Travel & Local,37 MB,4.1,11T,10L+,3+
232,SBSTC - Online Reservation,Powered by EIIPL,Travel & Local,4.9 MB,3.3,3T,5L+,3+
233,BRTS Ahmedabad,Entice Arc,Travel & Local,4.0 MB,4,928,1L+,3+
234,"Trip.com: Book Flights, Hotels",Trip.com,Travel & Local,54 MB,4.2,51T,1Cr+,3+
235,Indian Railway TrainGo Status for Where is myTrain,Team_Ballathe,Travel & Local,8.6 MB,4.2,337,1L+,3+
236,Statue of Unity Official,"Statue of Unity, SVPRET.",Travel & Local,9.0 MB,4.1,139,50T+,3+
237,Check Vehicle Resale Value,Extras Studeio,Travel & Local,9.0 MB,4.4,113,10T+,3+
238,Club Mahindra,Club Mahindra,Travel & Local,20 MB,4.4,13T,1L+,3+
239,Pizza delivery 2021 game,Famous Games Studio,Travel & Local,72 MB,4,7T,10L+,3+
240,Luxury Escapes - Travel Deals,Lux Group,Travel & Local,5.3 MB,4.3,3T,5L+,3+
241,Treebo: Hotel Booking App | Book Safe Stays,Treebo - Hotel Booking App,Travel & Local,12 MB,4.3,9T,10L+,3+
242,Critical Cover Strike Action: Offline Team Shooter,TAG: Action Games,Travel & Local,58 MB,3.6,6T,10L+,16+
243,RAIL SAARTHI - INDIAN RAILWAYS OFFICIAL APP,Centre for Railway Information Systems,Travel & Local,6.2 MB,3.8,25T,5L+,3+
244,OYO Lite: Find Best Hotels & Book At Great Deals,OYO,Travel & Local,878 kB,3.8,1T,1L+,3+
245,FlightAware Flight Tracker,FlightAware,Travel & Local,12 MB,4.1,42T,1Cr+,3+
246,Indian Train Status Companion : Seat Availability,i-Soft,Travel & Local,2.5 MB,4.1,6T,10L+,3+
247,"Train PNR Status, Order Food in Train",RailMitra: Best Railway App for PNR & Train Status,Travel & Local,655 kB,4.3,686,1L+,3+
248,Heavy Car Carrier 3D Truck,Vine Gamers Inc.,Travel & Local,39 MB,3.9,10T,10L+,3+
249,MAPinr - KML/KMZ/OFFLINE,Xylem Technologies,Travel & Local,14 MB,4.1,4T,5L+,3+
250,Auto Rickshaw Fare Calculator,sharma0909,Travel & Local,4.8 MB,4.2,739,1L+,3+
251,All Flight Tickets Booking app,TechMart,Travel & Local,3.3 MB,3.9,665,5L+,3+
252,Live Train Status PNR Enquiry,GIF & Frames Collection Apps,Travel & Local,5.5 MB,3.7,354,1L+,3+
253,Air Arabia (official app),Air Arabia,Travel & Local,25 MB,4,14T,10L+,3+
254,Live Train Status,Hindgen,Travel & Local,2.7 MB,4.2,1L,50L+,3+
255,Mumbai Local Bus (Live Timings & Fare ),Swaptr,Travel & Local,7.5 MB,3.4,94,50T+,3+
256,RTO Vehicle Details,Wine Pool Apps,Travel & Local,3.6 MB,3.7,65,10T+,3+
257,Light Speed hero: Crime Simulator: superhero games,Game Hippo Studio,Travel & Local,45 MB,3.8,5T,10L+,16+
258,Voice Gps Maps Travel Navigation & Traffic Alerts,Sibiti Apps,Travel & Local,9.1 MB,4.4,313,50T+,3+
259,Live Location on Map - Indian Railway,Offical DCS Inc.,Travel & Local,6.3 MB,3.8,2T,10L+,3+
260,Milk Tanker Driving Truck Game,Play 10,Travel & Local,49 MB,4.1,341,1L+,12+
261,Bangalore Local Bus BMTC,Bangalore Local,Travel & Local,9.7 MB,3.8,16,5T+,3+
262,Kolkata Metro,Annexbyte IT Solutions,Travel & Local,13 MB,4,3T,5L+,3+
263,IRCTC Tourism,IRCTC Official,Travel & Local,9.8 MB,4.2,8T,10L+,3+
264,Pune (Data) m-Indicator,Mobond,Travel & Local,75 kB,3.7,1T,5L+,3+
265,One Way Cab,OneWayCab,Travel & Local,11 MB,4,4T,1L+,3+
266,Tractor Trolley: Heavy Cargo Tractor Farming,Gamerox Studio,Travel & Local,30 MB,3.3,2T,10L+,3+
267,Surat Sitilink,Surat Smart City,Travel & Local,5.2 MB,2.4,1T,1L+,3+
268,Millitrack,Vehicle Tracking Systems,Travel & Local,6.2 MB,4.5,363,50T+,3+
269,"KAYAK Flights, Hotels & Cars",KAYAK.com,Travel & Local,25 MB,4.4,2L,1Cr+,3+
270,Tuk Tuk Auto Rickshaw Driving Simulator 2020,Lobitop Games,Travel & Local,44 MB,3.6,159,50T+,12+
271,Haryana Roadways Online Bus Tickets Booking App,"Software Development Centre, Haryana Roadways",Travel & Local,1.9 MB,2.3,755,1L+,3+
272,Offroad 4x4 Pickup Truck Stunt Driving Simulator,Offroad Games Simulation,Travel & Local,54 MB,4.1,205,1L+,3+
273,Daily Petrol Diesel Price Update in India,Skycap,Travel & Local,4.2 MB,4.3,9T,5L+,3+
274,The Flight Tracker,Impala Studios,Travel & Local,22 MB,4.4,26T,10L+,3+
275,Hijri calendar (Islamic Date) and Moon finder,j programmer,Travel & Local,7.6 MB,4.5,1T,5L+,3+
276,Train Booking & Food - Railofy,Railofy (Hotplate) - IRCTC Authorised Partner,Travel & Local,8.4 MB,4.1,358,50T+,3+
277,Satellite Map Navigation Route,Hifa tech,Travel & Local,9.0 MB,3.8,203,1L+,3+
278,Loka World app - Chat and meet new people,Global Travel Connection Apps OÜ,Travel & Local,21 MB,4.2,21T,1L+,12+
279,RTO Vehicle Information and Owner Details,dailyprint.in,Travel & Local,5.7 MB,4.1,71,10T+,3+
280,Train Robot Transformation War,Game Scapes Inc,Travel & Local,40 MB,4,1T,10L+,7+
281,VeriFLY: Fast Digital Identity,IdentityX,Travel & Local,29 MB,4.6,18T,10L+,3+
282,Offroad Pickup Cargo Truck 3D,Redstone Creatives,Travel & Local,43 MB,3.8,641,1L+,3+
283,Indian Railway Timetable 2022,ThinkLinux,Travel & Local,4.0 MB,4.1,90,50T+,3+
284,Gujarat ST Bus Time Tebal,welcome developer,Travel & Local,9.6 MB,4.1,60,10T+,12+
